objectid,title,interviewee,lastname,firstname,interviewer,creator,duration,description,date,subject,location,latitude,longitude,source,identifier,type,format,youtubeid,transcriber,language,rights,rightsstatement,object_location,image_small,image_thumb
demo_001,"Alexander Milles, April 15, 2018.","Milles, Alexander",Milles,Alexander,Denise Bennett,,31:01:00,,2018-04-15,,"Boise, Idaho",43.616667,-116.2,,,Image;MovingImage,video/mov,jagXJgIVmW0,Joyce,eng,"CC - Attribution 4.0 International. Digital reproduction rights assigned to the University of Idaho Library by donor/contributing institution/source (as applicable). For more information, please contact University of Idaho Library Special Collections and Archives Department at libspec@uidaho.edu.",https://creativecommons.org/licenses/by/4.0/,https://youtu.be/jagXJgIVmW0,https://www.lib.uidaho.edu/media/queered/small/idlgbtqhistory-31_sm.jpg,https://www.lib.uidaho.edu/media/queered/thumbs/idlgbtqhistory-31_th.jpg
demo_002,"Amy Amethyst Rose Teraberry, August 18, 2018.","Teraberry, Amy Amethyst Rose",Teraberry,Amy Amethyst Rose,Denise Bennett,,38:03:00,,2018-08-18,,"McCall, Idaho",43.616667,-116.2,,,Image;MovingImage,video/mov,yv0eGmfNqR8,,eng,"CC - Attribution 4.0 International. Digital reproduction rights assigned to the University of Idaho Library by donor/contributing institution/source (as applicable). For more information, please contact University of Idaho Library Special Collections and Archives Department at libspec@uidaho.edu.",https://creativecommons.org/licenses/by/4.0/,https://youtu.be/yv0eGmfNqR8,https://www.lib.uidaho.edu/media/queered/small/idlgbtqhistory-10_sm.jpg,https://www.lib.uidaho.edu/media/queered/thumbs/idlgbtqhistory-10_th.jpg
demo_003,"Anonymous, July 11, 2018.",Anonymous,,Anonymous,Denise Bennett,,36:00:00,,2018-07-11,,"Coeur d'Alene, Idaho",47.692778,-116.78,,,Image;MovingImage,video/mov,6CxzNHqfLhA,Joyce,eng,"CC - Attribution 4.0 International. Digital reproduction rights assigned to the University of Idaho Library by donor/contributing institution/source (as applicable). For more information, please contact University of Idaho Library Special Collections and Archives Department at libspec@uidaho.edu.",https://creativecommons.org/licenses/by/4.0/,https://youtu.be/6CxzNHqfLhA,https://www.lib.uidaho.edu/media/queered/small/idlgbtqhistory-01_sm.jpg,https://www.lib.uidaho.edu/media/queered/thumbs/idlgbtqhistory-01_th.jpg
demo_004,"Administration Building, University of Idaho, No. 30",,,,,Pacific Photo Co.,,"Example locally hosted image item. Photographic postcard of the University of Idaho administration building in Moscow, Idaho.",1910,universities; buildings; campuses; picture postcards,"Moscow, Idaho",46.725562,-117.009633,"PG 9, Postcard Collection, Special Collections and Archives, University of Idaho Library",pg_9_12_01bl,Image;StillImage,image/jpeg,,,eng,"In Copyright - Educational Use Permitted. For more information, please contact University of Idaho Library Special Collections and Archives Department at libspec@uidaho.edu.",http://rightsstatements.org/vocab/NoC-US/1.0/,/objects/demo_001.jpg,/objects/small/demo_001_sm.jpg,/objects/thumbs/demo_001_th.jpg
demo_005,"Spokane County Court House, Spokane, Washington",,,,,Spokane Post Card Co.,,"Example locally hosted PDF item. Postcard is of the Spokane County Courthouse in Spokane, Washington. Postmark 9/8/1912, Spokane, WA. Destination San Francisco, CA.",1912-09-08,public buildings; county courthouses; trees; picture postcards,"Spokane, Washington",47.66432,-117.428031,"PG 107, Knowles Postcard Collection, Special Collections and Archives, University of Idaho Library",Postcard_032,Image;StillImage,application/pdf,,,eng,"In Copyright - Educational Use Permitted. For more information, please contact University of Idaho Library Special Collections and Archives Department at libspec@uidaho.edu.",http://rightsstatements.org/vocab/NoC-US/1.0/,/objects/demo_005.pdf,/objects/small/demo_005_sm.jpg,/objects/thumbs/demo_005_th.jpg
demo_006,Good News – Power (radio episode),,,,,Frank B. Robinson,,Example locally hosted audio item. Psychiana radio program episode begins with assurance that there is a Power that can get people what they desire. Robinson then discusses his early life failures and childhood seeking of some force that could turn his failures into success. He asserts the God-Power can turn our failures into success and bring us material and spiritual abundance.,1947,Frank B. Robinson; Failure; Success; Material Abundance,"Moscow, Idaho",46.733001,-116.991779,"Psychiana Digital Collection, Digital Initiatives, University of Idaho Library, https://www.lib.uidaho.edu/digital/psychiana/",Good_News_08,Audio,audio/mpeg,,,eng,"Material produced by the United States Forest Service and is in Public Domain. For more information, please contact University of Idaho Library Special Collections and Archives Department at libspec@uidaho.edu.",http://rightsstatements.org/vocab/InC-EDU/1.0/,/objects/demo_003.mp3,/objects/small/demo_003_sm.jpg,/objects/thumbs/demo_003_th.jpg